{
  "schema_version": 1,
  "idempotency_key": "d01-synthetic-change",
  "discussion_id": "01K00000000000000000000006",
  "expected_version": 1,
  "action": "decide",
  "decision": {
    "kind": "needs_more_context",
    "summary": "Synthetic unresolved tradeoff.",
    "recommendation_ids": ["01K00000000000000000000020", "01K00000000000000000000021"]
  }
}
